{
  "$schema": "http://json-schema.org/draft-07/schema#",
  "$id": "https://raincough.local/plugin.json.v4.schema.json",
  "title": "RainCough 插件清单 v4",
  "type": "object",
  "required": ["name", "label", "version", "frontend", "backend", "interfaces"],
  "additionalProperties": false,
  "properties": {
    "name": { "type": "string", "pattern": "^[a-z0-9_-]{1,32}$" },
    "label": { "type": "string", "minLength": 1, "maxLength": 64 },
    "version": { "type": "string", "minLength": 1, "maxLength": 32 },
    "description": { "type": "string", "maxLength": 1024 },
    "author": { "type": "string", "maxLength": 128 },
    "icon": { "type": "string", "maxLength": 512 },
    "requirements": {
      "type": "array",
      "description": "python 依赖(安装插件时由面板 pip install; AI 重依赖走 env-ai 离线轮子)",
      "items": { "type": "string", "minLength": 1, "maxLength": 128 }
    },
    "frontend": {
      "type": "object",
      "required": ["entry"],
      "additionalProperties": false,
      "properties": {
        "entry": { "type": "string", "minLength": 1, "maxLength": 512 },
        "vue": { "type": "string", "default": "3.5" },
        "pages": {
          "type": "array",
          "items": {
            "type": "object",
            "required": ["title"],
            "properties": {
              "path": { "type": "string", "default": "" },
              "title": { "type": "string", "minLength": 1 }
            }
          }
        }
      }
    },
    "backend": {
      "type": "object",
      "required": ["exec"],
      "additionalProperties": false,
      "properties": {
        "lang": { "type": "string", "default": "python" },
        "exec": { "type": "array", "minItems": 1, "items": { "type": "string" } },
        "capabilities": {
          "type": "array",
          "items": { "enum": ["invoke", "heartbeat", "log.tail", "stream"] }
        }
      }
    },
    "interfaces": {
      "type": "array",
      "items": {
        "type": "object",
        "required": ["id"],
        "additionalProperties": false,
        "properties": {
          "id": { "type": "string", "pattern": "^[a-z0-9_]+\\.[a-z0-9_.]+$" },
          "input": { "type": "object" },
          "output": { "type": "object" },
          "visibility": { "enum": ["all", "main", "private"], "default": "all" },
          "version": { "type": "string", "default": "1" },
          "description": { "type": "string", "maxLength": 512 }
        }
      }
    }
  }
}